{
  "schema_version": 1,
  "batch_id": "10ad7e76-5952-4e90-af6b-b97d4d284f3d",
  "collected_at": "2026-07-31T12:25:35.624239Z",
  "metrics": {
    "cpu_percent": 39.9,
    "memory_percent": 82.9,
    "disk_percent": 75.1,
    "network_bytes_sent": 7978788223,
    "network_bytes_recv": 33703473740
  },
  "inventory": {
    "hostname": "DESKTOP-UL80L8P",
    "os": "windows",
    "os_version": "Windows-10-10.0.26200-SP0",
    "architecture": "AMD64",
    "agent_version": "0.1.0",
    "boot_time": "2026-07-31T00:09:48.323920Z",
    "ip_addresses": [
      "04-BF-1B-74-16-8E",
      "169.254.76.82",
      "fe80::d87a:4f37:52e9:c508",
      "0A-00-27-00-00-12",
      "192.168.56.1",
      "fe80::bf91:3b83:50c7:226e",
      "02-00-4C-4F-4F-50",
      "169.254.212.70",
      "fe80::9292:d1a7:7332:a7b4",
      "B0-DC-EF-14-84-86",
      "169.254.249.3",
      "fe80::1056:bfec:8c0d:7e41",
      "B2-DC-EF-14-84-85",
      "169.254.88.50",
      "fe80::bd10:302f:35dd:521b",
      "B0-DC-EF-14-84-85",
      "192.168.1.5",
      "2409:8a04:322f:9530:4ebd:1497:4a6d:495c",
      "2409:8a04:322f:9530:5dbc:9933:2fda:1f81",
      "fe80::7ecb:d264:87c:6978",
      "B0-DC-EF-14-84-89",
      "169.254.47.38",
      "fe80::7374:2af3:41ec:ee50",
      "00-15-5D-6F-DE-F9",
      "172.23.64.1",
      "fe80::d2a3:9159:565d:240e",
      "198.18.0.1",
      "fdfe:dcba:9876::1",
      "127.0.0.1",
      "::1"
    ]
  },
  "processes": [
    {
      "pid": 0,
      "name": "System Idle Process",
      "executable": null,
      "username": "NT AUTHORITY\\SYSTEM",
      "started_at": "1970-01-01T00:00:00Z"
    },
    {
      "pid": 4,
      "name": "System",
      "executable": null,
      "username": "NT AUTHORITY\\SYSTEM",
      "started_at": "1970-01-01T00:00:00Z"
    },
    {
      "pid": 320,
      "name": "Registry",
      "executable": "Registry",
      "username": null,
      "started_at": "2026-07-31T00:09:48.620933Z"
    },
    {
      "pid": 916,
      "name": "smss.exe",
      "executable": "C:\\Windows\\System32\\smss.exe",
      "username": null,
      "started_at": "2026-07-31T00:09:51.710312Z"
    },
    {
      "pid": 1036,
      "name": "svchost.exe",
      "executable": "C:\\Windows\\System32\\svchost.exe",
      "username": null,
      "started_at": "2026-07-31T00:10:01.507711Z"
    },
    {
      "pid": 1408,
      "name": "svchost.exe",
      "executable": "C:\\Windows\\System32\\svchost.exe",
      "username": null,
      "started_at": "2026-07-31T00:10:01.950367Z"
    },
    {
      "pid": 1428,
      "name": "csrss.exe",
      "executable": "C:\\Windows\\System32\\csrss.exe",
      "username": null,
      "started_at": "2026-07-31T00:09:58.842205Z"
    },
    {
      "pid": 1544,
      "name": "wininit.exe",
      "executable": "C:\\Windows\\System32\\wininit.exe",
      "username": null,
      "started_at": "2026-07-31T00:10:01.041828Z"
    },
    {
      "pid": 1552,
      "name": "csrss.exe",
      "executable": "C:\\Windows\\System32\\csrss.exe",
      "username": null,
      "started_at": "2026-07-31T00:10:01.044172Z"
    },
    {
      "pid": 1640,
      "name": "winlogon.exe",
      "executable": "C:\\Windows\\System32\\winlogon.exe",
      "username": null,
      "started_at": "2026-07-31T00:10:01.360239Z"
    },
    {
      "pid": 1660,
      "name": "services.exe",
      "executable": "C:\\Windows\\System32\\services.exe",
      "username": null,
      "started_at": "2026-07-31T00:10:01.369213Z"
    },
    {
      "pid": 1692,
      "name": "lsass.exe",
      "executable": "C:\\Windows\\System32\\lsass.exe",
      "username": null,
      "started_at": "2026-07-31T00:10:01.388592Z"
    },
    {
      "pid": 1724,
      "name": "WUDFHost.exe",
      "executable": "C:\\Windows\\System32\\WUDFHost.exe",
      "username": null,
      "started_at": "2026-07-31T00:10:01.526403Z"
    },
    {
      "pid": 1732,
      "name": "chrome.exe",
      "executable": "C:\\Program Files\\Google\\Chrome\\Application\\chrome.exe",
      "username": "DESKTOP-UL80L8P\\33185",
      "started_at": "2026-07-31T01:43:38.871675Z"
    },
    {
      "pid": 1848,
      "name": "fontdrvhost.exe",
      "executable": "C:\\Windows\\System32\\fontdrvhost.exe",
      "username": null,
      "started_at": "2026-07-31T00:10:01.462124Z"
    },
    {
      "pid": 1852,
      "name": "fontdrvhost.exe",
      "executable": "C:\\Windows\\System32\\fontdrvhost.exe",
      "username": null,
      "started_at": "2026-07-31T00:10:01.462126Z"
    },
    {
      "pid": 1864,
      "name": "svchost.exe",
      "executable": "C:\\Windows\\System32\\svchost.exe",
      "username": null,
      "started_at": "2026-07-31T00:10:01.462405Z"
    },
    {
      "pid": 1920,
      "name": "WUDFHost.exe",
      "executable": "C:\\Windows\\System32\\WUDFHost.exe",
      "username": null,
      "started_at": "2026-07-31T00:10:01.471096Z"
    },
    {
      "pid": 2016,
      "name": "svchost.exe",
      "executable": "C:\\Windows\\System32\\svchost.exe",
      "username": null,
      "started_at": "2026-07-31T00:10:01.491974Z"
    },
    {
      "pid": 2072,
      "name": "svchost.exe",
      "executable": "C:\\Windows\\System32\\svchost.exe",
      "username": null,
      "started_at": "2026-07-31T00:10:01.632493Z"
    },
    {
      "pid": 2088,
      "name": "dwm.exe",
      "executable": "C:\\Windows\\System32\\dwm.exe",
      "username": null,
      "started_at": "2026-07-31T00:10:01.546882Z"
    },
    {
      "pid": 2112,
      "name": "msedge.exe",
      "executable": "C:\\Program Files (x86)\\Microsoft\\Edge\\Application\\msedge.exe",
      "username": "DESKTOP-UL80L8P\\33185",
      "started_at": "2026-07-31T10:32:06.007398Z"
    },
    {
      "pid": 2192,
      "name": "msedgewebview2.exe",
      "executable": "C:\\Program Files (x86)\\Microsoft\\EdgeWebView\\Application\\150.0.4078.105\\msedgewebview2.exe",
      "username": "DESKTOP-UL80L8P\\33185",
      "started_at": "2026-07-31T00:13:00.949308Z"
    },
    {
      "pid": 2204,
      "name": "svchost.exe",
      "executable": "C:\\Windows\\System32\\svchost.exe",
      "username": null,
      "started_at": "2026-07-31T00:10:01.569009Z"
    },
    {
      "pid": 2224,
      "name": "svchost.exe",
      "executable": "C:\\Windows\\System32\\svchost.exe",
      "username": null,
      "started_at": "2026-07-31T00:10:01.569748Z"
    },
    {
      "pid": 2240,
      "name": "svchost.exe",
      "executable": "C:\\Windows\\System32\\svchost.exe",
      "username": null,
      "started_at": "2026-07-31T00:10:01.569925Z"
    },
    {
      "pid": 2256,
      "name": "svchost.exe",
      "executable": "C:\\Windows\\System32\\svchost.exe",
      "username": null,
      "started_at": "2026-07-31T00:10:01.571644Z"
    },
    {
      "pid": 2276,
      "name": "svchost.exe",
      "executable": "C:\\Windows\\System32\\svchost.exe",
      "username": null,
      "started_at": "2026-07-31T00:10:01.572332Z"
    },
    {
      "pid": 2284,
      "name": "svchost.exe",
      "executable": "C:\\Windows\\System32\\svchost.exe",
      "username": null,
      "started_at": "2026-07-31T00:10:01.572881Z"
    },
    {
      "pid": 2400,
      "name": "HipsTray.exe",
      "executable": "C:\\Program Files\\Huorong\\Sysdiag\\bin\\HipsTray.exe",
      "username": "DESKTOP-UL80L8P\\33185",
      "started_at": "2026-07-31T00:10:21.140138Z"
    },
    {
      "pid": 2440,
      "name": "svchost.exe",
      "executable": "C:\\Windows\\System32\\svchost.exe",
      "username": null,
      "started_at": "2026-07-31T00:10:01.579886Z"
    },
    {
      "pid": 2496,
      "name": "svchost.exe",
      "executable": "C:\\Windows\\System32\\svchost.exe",
      "username": null,
      "started_at": "2026-07-31T00:10:01.583884Z"
    },
    {
      "pid": 2556,
      "name": "msedgewebview2.exe",
      "executable": "C:\\Program Files (x86)\\Microsoft\\EdgeWebView\\Application\\150.0.4078.105\\msedgewebview2.exe",
      "username": "DESKTOP-UL80L8P\\33185",
      "started_at": "2026-07-31T09:16:22.810555Z"
    },
    {
      "pid": 2560,
      "name": "svchost.exe",
      "executable": "C:\\Windows\\System32\\svchost.exe",
      "username": null,
      "started_at": "2026-07-31T00:10:01.588347Z"
    },
    {
      "pid": 2616,
      "name": "svchost.exe",
      "executable": "C:\\Windows\\System32\\svchost.exe",
      "username": null,
      "started_at": "2026-07-31T00:10:01.593085Z"
    },
    {
      "pid": 2744,
      "name": "svchost.exe",
      "executable": "C:\\Windows\\System32\\svchost.exe",
      "username": null,
      "started_at": "2026-07-31T00:10:01.604427Z"
    },
    {
      "pid": 2752,
      "name": "svchost.exe",
      "executable": "C:\\Windows\\System32\\svchost.exe",
      "username": null,
      "started_at": "2026-07-31T00:10:01.604555Z"
    },
    {
      "pid": 2760,
      "name": "svchost.exe",
      "executable": "C:\\Windows\\System32\\svchost.exe",
      "username": null,
      "started_at": "2026-07-31T00:10:01.605283Z"
    },
    {
      "pid": 2836,
      "name": "WUDFHost.exe",
      "executable": "C:\\Windows\\System32\\WUDFHost.exe",
      "username": null,
      "started_at": "2026-07-31T00:10:01.614708Z"
    },
    {
      "pid": 2896,
      "name": "sandbox-cli.exe",
      "executable": "C:\\Users\\33185\\AppData\\Local\\Programs\\WorkBuddy\\resources\\app.asar.unpacked\\cli\\vendor\\sandbox\\sandbox-cli.exe",
      "username": "DESKTOP-UL80L8P\\33185",
      "started_at": "2026-07-31T11:49:33.036033Z"
    },
    {
      "pid": 2956,
      "name": "svchost.exe",
      "executable": "C:\\Windows\\System32\\svchost.exe",
      "username": null,
      "started_at": "2026-07-31T00:10:01.622691Z"
    },
    {
      "pid": 2964,
      "name": "IntelCpHDCPSvc.exe",
      "executable": "C:\\Windows\\System32\\DriverStore\\FileRepository\\iigd_dch.inf_amd64_cbfaa9cd064ee779\\IntelCpHDCPSvc.exe",
      "username": null,
      "started_at": "2026-07-31T00:10:01.623536Z"
    },
    {
      "pid": 2972,